{
  "$schema": "https://json-schema.org/draft/2020-12/schema",
  "$id": "https://agentflow.dev/schemas/agentflow-config.schema.json",
  "title": "AgentFlow Canonical Configuration",
  "type": "object",
  "required": ["version"],
  "properties": {
    "version": {
      "type": "integer",
      "const": 1
    },
    "authority": {
      "type": "object",
      "properties": {
        "human": {
          "type": "string"
        },
        "machine": {
          "type": "string"
        },
        "executionAdapter": {
          "type": "string"
        }
      },
      "additionalProperties": true
    },
    "principles": {
      "type": "array",
      "items": {
        "type": "string"
      }
    },
    "vocabulary": {
      "type": "object",
      "additionalProperties": true
    },
    "roles": {
      "type": "array",
      "items": {
        "type": "object",
        "required": ["phase", "slug", "label", "owns"],
        "properties": {
          "phase": {
            "type": "integer",
            "minimum": 0
          },
          "slug": {
            "type": "string",
            "pattern": "^[a-z0-9]+(?:-[a-z0-9]+)*$"
          },
          "label": {
            "type": "string"
          },
          "owns": {
            "type": "array",
            "items": {
              "type": "string"
            }
          }
        },
        "additionalProperties": true
      }
    },
    "paths": {
      "type": "object",
      "additionalProperties": true
    },
    "transitions": {
      "type": "array",
      "items": {
        "type": "array",
        "minItems": 2,
        "maxItems": 2,
        "items": {
          "type": "string"
        }
      }
    },
    "labels": {
      "type": "object",
      "additionalProperties": true
    },
    "release": {
      "type": "object",
      "additionalProperties": true
    },
    "gateways": {
      "type": "object",
      "additionalProperties": true
    },
    "actionPolicy": {
      "type": "object",
      "additionalProperties": true
    },
    "extensionPolicy": {
      "type": "object",
      "additionalProperties": true
    },
    "deliveryPolicy": {
      "type": "object",
      "additionalProperties": true
    },
    "ciCommands": {
      "type": "array",
      "items": {
        "type": "string"
      }
    },
    "bounded": {
      "type": "object",
      "additionalProperties": true
    },
    "branching": {
      "type": "object",
      "additionalProperties": true
    },
    "integrationLifecycle": {
      "type": "object",
      "additionalProperties": true
    },
    "routing": {
      "type": "object",
      "properties": {
        "defaultMode": {
          "type": "string"
        },
        "agents": {
          "type": "object",
          "additionalProperties": true
        },
        "roles": {
          "type": "object",
          "additionalProperties": true
        }
      },
      "additionalProperties": true
    },
    "orchestration": {
      "type": "object",
      "properties": {
        "lifecycle": {
          "type": "string"
        },
        "preCodeReview": {
          "type": "object",
          "additionalProperties": true
        },
        "concurrency": {
          "type": "object",
          "additionalProperties": true
        }
      },
      "additionalProperties": true
    },
    "execution": {
      "type": "object",
      "properties": {
        "escalation": {
          "type": "object",
          "additionalProperties": true
        },
        "fallbackCascade": {
          "type": "object",
          "additionalProperties": true
        }
      },
      "additionalProperties": true
    },
    "models": {
      "type": "object",
      "properties": {
        "tiers": {
          "type": "object",
          "additionalProperties": true
        },
        "roleAssignments": {
          "type": "object",
          "additionalProperties": true
        }
      },
      "additionalProperties": true
    },
    "harness": {
      "type": "object",
      "properties": {
        "shellRunner": {
          "type": "object",
          "additionalProperties": true
        },
        "limits": {
          "type": "object",
          "additionalProperties": true
        },
        "scratchPath": {
          "type": "string"
        }
      },
      "additionalProperties": true
    },
    "adapters": {
      "type": "object",
      "additionalProperties": true,
      "properties": {
        "openrig": {
          "type": "object",
          "properties": {
            "rig": {
              "type": "object"
            },
            "executionPolicy": {
              "type": "object",
              "properties": {
                "seats": {
                  "type": "object",
                  "additionalProperties": {
                    "type": "object",
                    "properties": {
                      "executionTarget": {
                        "type": "string",
                        "minLength": 1
                      },
                      "providerRoute": {
                        "type": "string",
                        "minLength": 1
                      },
                      "providerFamily": {
                        "type": "string",
                        "minLength": 1
                      },
                      "model": {
                        "type": "string",
                        "minLength": 1
                      },
                      "profile": {
                        "type": "string",
                        "minLength": 1
                      },
                      "capabilityTier": {
                        "type": "string",
                        "minLength": 1
                      },
                      "runtime": {
                        "enum": ["pi", "codex", "claude-code"]
                      },
                      "effort": {
                        "enum": ["off", "none", "minimal", "low", "medium", "high", "xhigh", "max"]
                      },
                      "platform": {
                        "type": "string",
                        "minLength": 1
                      }
                    },
                    "additionalProperties": false
                  }
                },
                "activation": {
                  "enum": ["active", "held"],
                  "description": "Held permits desired previews only; it grants no installed mutation authority."
                }
              },
              "additionalProperties": true
            }
          },
          "additionalProperties": true
        }
      }
    },
    "executionTopology": {
      "type": "object",
      "properties": {
        "substrateTier": {
          "enum": ["auto", "s0-single-cli", "s1-multi-cli", "s2-openrig-squad"]
        },
        "openrigSquadPreset": {
          "enum": ["lean-4-seat", "multi-tier-7-seat"]
        },
        "compositeBuilderMaxRung": {
          "enum": ["P0", "P1"]
        }
      },
      "additionalProperties": true
    },
    "effortPolicy": {
      "type": "object",
      "properties": {
        "defaultLoopEffort": {
          "enum": ["low", "medium", "high"]
        },
        "subagentSearchEffort": {
          "enum": ["low", "medium"]
        },
        "highEffortMaxContextTokens": {
          "type": "integer",
          "minimum": 8000
        },
        "enforceCleanSubagentForHighEffort": {
          "type": "boolean"
        }
      },
      "additionalProperties": true
    },
    "executionDistribution": {
      "type": "object",
      "additionalProperties": false,
      "required": ["profile", "profileDigest"],
      "properties": {
        "profile": {
          "type": "string",
          "minLength": 1
        },
        "profileDigest": {
          "type": "string",
          "pattern": "^[a-f0-9]{64}$"
        },
        "overrides": {
          "type": "object",
          "additionalProperties": {
            "type": "object",
            "additionalProperties": false,
            "required": ["reason", "options"],
            "properties": {
              "reason": {
                "type": "string",
                "minLength": 1
              },
              "options": {
                "type": "array",
                "minItems": 3,
                "maxItems": 3,
                "items": {
                  "type": "object"
                }
              }
            }
          }
        }
      }
    }
  },
  "additionalProperties": true
}
